{"claims":[{"claim_id":"urls-canonical","statement":{"homepage":"https://junglecat.example.com/","security":"https://junglecat.example.com/security"},"type":"canonical_urls"},{"claim_id":"channels-official","statement":{"email_domains":["junglecat.example.com"]},"type":"official_channels"}],"document_id":"test-vector-v0.1-strict-002","entity":{"name":"JungleCat, Inc.","primary_domain":"junglecat.example.com"},"llmo_version":"0.1","valid_from":"2026-04-20T00:00:00Z","valid_until":"2026-10-17T00:00:00Z"}