{
  "llmo_version": "0.1",
  "document_id": "test-vector-v0.1.8-hours-001",
  "valid_from": "2026-05-11T00:00:00Z",
  "valid_until": "2026-11-07T00:00:00Z",
  "entity": {
    "name": "JungleCat, Inc.",
    "primary_domain": "junglecat.example.com"
  },
  "claims": [
    {
      "claim_id": "hours-001",
      "type": "hours",
      "statement": {
        "regular": {
          "monday": [{ "open": "09:00", "close": "17:00" }],
          "tuesday": [{ "open": "09:00", "close": "17:00" }],
          "wednesday": [{ "open": "09:00", "close": "17:00" }],
          "thursday": [{ "open": "09:00", "close": "24:00" }],
          "friday": [
            { "open": "09:00", "close": "17:00" },
            { "open": "22:00", "close": "02:00", "is_overnight": true }
          ],
          "saturday": [{ "open": "10:00", "close": "14:00" }]
        },
        "exceptions": [
          { "date": "2026-12-25", "closed": true }
        ],
        "alternate": {
          "brunch": {
            "saturday": [{ "open": "10:00", "close": "14:00" }],
            "sunday": [{ "open": "10:00", "close": "14:00" }]
          }
        }
      }
    }
  ]
}
