{
  "llmo_version": "0.1",
  "document_id": "test-vector-v0.1.8-operational-status-001",
  "valid_from": "2026-05-11T00:00:00Z",
  "valid_until": "2026-11-07T00:00:00Z",
  "entity": {
    "name": "JungleCat, Inc.",
    "primary_domain": "junglecat.example.com"
  },
  "claims": [
    {
      "claim_id": "operational-status-001",
      "type": "operational_status",
      "statement": {
        "status": "opening_soon",
        "effective_date": "2026-06-01",
        "reason": "Renovation complete; reopening to the public."
      }
    }
  ]
}
