{
  "llmo_version": "0.1",
  "document_id": "test-vector-v0.1.8-categories-001",
  "valid_from": "2026-05-11T00:00:00Z",
  "valid_until": "2026-11-07T00:00:00Z",
  "entity": {
    "name": "JungleCat, Inc.",
    "primary_domain": "junglecat.example.com"
  },
  "claims": [
    {
      "claim_id": "categories-001",
      "type": "categories",
      "statement": {
        "primary": "https://schema.org/Restaurant",
        "secondary": [
          "https://schema.org/CafeOrCoffeeShop"
        ],
        "naics": ["722511"]
      }
    }
  ]
}
