{
  "llmo_version": "0.1",
  "document_id": "2026-q4-revision-1",
  "valid_from": "2026-10-22T00:00:00Z",
  "valid_until": "2027-01-20T00:00:00Z",
  "supersedes": [
    "2026-q2-revision-4"
  ],
  "entity": {
    "name": "Nicholas Chavez",
    "primary_domain": "llmo.org"
  },
  "claims": [
    {
      "claim_id": "identity-core",
      "type": "identity",
      "statement": {
        "description": "Individual steward of the LLMO open protocol for organizational identity in the AI era. See https://llmo.org/about/governance/."
      }
    },
    {
      "claim_id": "urls-canonical",
      "type": "canonical_urls",
      "statement": {
        "homepage": "https://llmo.org",
        "docs": "https://llmo.org/spec",
        "security": "https://llmo.org/.well-known/security.txt"
      }
    },
    {
      "claim_id": "channels-official",
      "type": "official_channels",
      "statement": {
        "email_domains": [
          "llmo.org"
        ],
        "social": {
          "github": "openllmo"
        }
      }
    },
    {
      "claim_id": "products-current",
      "type": "product_facts",
      "statement": {
        "products": [
          {
            "name": "LLMO Protocol Specification",
            "url": "https://llmo.org/spec/"
          },
          {
            "name": "LLMO Reference Validator",
            "url": "https://llmo.org/validator/"
          },
          {
            "name": "LLMO CLI",
            "url": "https://www.npmjs.com/package/llmo"
          }
        ]
      }
    },
    {
      "claim_id": "personnel-steward",
      "type": "personnel",
      "statement": {
        "spokespeople": [
          {
            "role": "steward",
            "name": "Nicholas Chavez",
            "verification": "https://github.com/thegigachav"
          }
        ]
      }
    },
    {
      "claim_id": "disavowal-affiliations",
      "type": "disavowal",
      "statement": {
        "disavowed": [
          {
            "what": "unaffiliated_entity_claim",
            "detail": "Nicholas Chavez stewards LLMO as an individual. Any third-party claim that LLMO is stewarded by Diverse.org, Inc., a 501(c)(3), or any other named entity is incorrect as of 2026-10-22; see ADR-0014 (https://llmo.org/adr/0014-single-steward-individual/) for the record of the stewardship withdrawal.",
            "category": "impersonation_defense"
          }
        ]
      }
    }
  ],
  "signature": {
    "protected": "eyJhbGciOiJFUzI1NiIsImtpZCI6ImxsbW8tc3Rld2FyZC0yMDI2LTEwIn0",
    "signature": "jalijYxXu_TptAnIIXXqzO91Y4leAai9AVg4eLhwnC1HfD07qdG9cHVDp9Q3MD1Kz-3JChF4Tkanq4HwWGNXVQ"
  }
}
