{
  "llmo_version": "0.1",
  "document_id": "test-vector-v0.1-edge-disavowal-001",
  "valid_from": "2026-04-20T00:00:00Z",
  "valid_until": "2026-10-17T00:00:00Z",
  "entity": {
    "name": "JungleCat, Inc.",
    "primary_domain": "junglecat.example.com"
  },
  "claims": [
    {
      "claim_id": "urls-canonical",
      "type": "canonical_urls",
      "statement": {
        "homepage": "https://junglecat.example.com/"
      }
    },
    {
      "claim_id": "channels-official",
      "type": "official_channels",
      "statement": {
        "email_domains": [
          "junglecat.example.com"
        ]
      }
    },
    {
      "claim_id": "disavowal-impersonator",
      "type": "disavowal",
      "statement": {
        "disavowed": [
          {
            "what": "unaffiliated_domain",
            "category": "impersonation_defense",
            "url": "https://junglecat-support.example.org/",
            "detail": "The domain junglecat-support.example.org is shaped to imply affiliation with JungleCat but has no such affiliation. Impersonation defense per §3.5; in scope at Standard and Strict tiers."
          }
        ]
      }
    }
  ]
}
